{
  "$schema": "http://json-schema.org/draft-07/schema#",
  "$comment": "GENERATED by gui/schema-gen/derive_nf_config_schemas.py from config/nef.json + its source (ADR-0425). Do not edit; regenerate.",
  "title": "nef",
  "type": "object",
  "additionalProperties": false,
  "properties": {
    "port": {
      "type": "integer",
      "x-cpp-type": "unsigned short"
    },
    "sbi_bind_address": {
      "type": "string",
      "x-cpp-type": "std::string"
    },
    "metrics_bind_address": {
      "type": "string",
      "x-cpp-type": "std::string"
    },
    "nrf_base_url": {
      "type": "string",
      "x-env-override": "NEF_NRF_BASE_URL",
      "x-cpp-type": "std::string"
    },
    "self_base_url": {
      "type": "string",
      "x-env-override": "NEF_SELF_BASE_URL",
      "x-cpp-type": "std::string"
    },
    "udr_base_url": {
      "type": "string",
      "x-env-override": "NEF_UDR_BASE_URL",
      "x-cpp-type": "std::string"
    },
    "pcf_base_url": {
      "type": "string",
      "x-env-override": "NEF_PCF_BASE_URL",
      "x-cpp-type": "std::string"
    },
    "udm_base_url": {
      "type": "string",
      "x-env-override": "NEF_UDM_BASE_URL",
      "x-cpp-type": "std::string"
    },
    "aanf_base_url": {
      "type": "string"
    },
    "li_poi": {
      "type": "object",
      "additionalProperties": false,
      "properties": {
        "enabled": {
          "type": "boolean"
        },
        "x1_bind_address": {
          "type": "string"
        },
        "x1_port": {
          "type": "integer"
        },
        "ne_identifier": {
          "type": "string"
        },
        "network_function_id": {
          "type": "string"
        },
        "interception_point_id": {
          "type": "string"
        },
        "mdf2_host": {
          "type": "string"
        },
        "mdf2_port": {
          "type": "integer"
        },
        "mdf2_sni": {
          "type": "string"
        },
        "x1_keepalive_p1_seconds": {
          "type": "integer"
        },
        "x1_keepalive_p2_seconds": {
          "type": "integer"
        },
        "x1_keepalive_p3_seconds": {
          "type": "integer"
        },
        "x1_allow_deactivate_all": {
          "type": "boolean"
        }
      }
    },
    "tsctsf_base_url": {
      "type": "string"
    },
    "oauth2_required": {
      "type": "boolean",
      "x-env-override": "NEF_OAUTH2_REQUIRED",
      "x-cpp-type": "bool"
    }
  },
  "required": [
    "metrics_bind_address",
    "nrf_base_url",
    "pcf_base_url",
    "port",
    "sbi_bind_address",
    "self_base_url",
    "udm_base_url",
    "udr_base_url"
  ],
  "x-config-file": "config/nef.json",
  "x-source": [
    "nfs/nef"
  ],
  "x-apply": "restart",
  "x-review": [
    "li_poi: nested object shape inferred from current values (map-vs-struct meaning unverified; new keys refused until reviewed)"
  ]
}
